{
  "version": "4.0.0",
  "methodology_version": "4.0.0",
  "current_state": "shipped",
  "previous_state": "initialized",
  "project": "视频自动化生产平台",
  "current_feature": "001",
  "feature_context": {
    "complexity_tier": "standard",
    "implementation_mode": "greenfield",
    "existing_implementation_note": null
  },
  "ready_for_build": false,
  "shipped_features": [],
  "initialized_at": "2026-05-05T05:53:47Z",
  "specified_at": "2026-05-05T08:46:25Z",
  "planned_at": "2026-05-05T08:58:10Z",
  "building_at": "2026-05-05T09:05:10Z",
  "shipped_at": "2026-05-05T09:41:53Z",
  "learned_at": null,
  "internal_stage": "implementing",
  "artifacts": {
    "foundation_review_path": "docs/00-project/foundation-review.md",
    "prebuild_review_path": "docs/01-features/001-knowledge-task-skeleton/prebuild-review.md",
    "feature_path": "docs/01-features/001-knowledge-task-skeleton/feature.md",
    "design_path": "docs/01-features/001-knowledge-task-skeleton/design.md",
    "tasks_path": "docs/01-features/001-knowledge-task-skeleton/tasks.md",
    "review_note_path": "docs/01-features/001-knowledge-task-skeleton/review-note.md",
    "validation_report_path": "docs/01-features/001-knowledge-task-skeleton/validation-report.md",
    "release_record_path": "docs/01-features/001-knowledge-task-skeleton/release-record.md",
    "validation_evidence_index_path": null,
    "tdd_receipts_dir": null
  },
  "contract_schemas": {
    "state_schema_path": ".bewater/contracts/state.schema.json",
    "gate_schema_path": ".bewater/contracts/gate.schema.json",
    "builder_receipt_schema_path": ".bewater/contracts/builder-receipt.schema.json",
    "tdd_receipt_schema_path": ".bewater/contracts/tdd-receipt.schema.json",
    "validation_evidence_schema_path": ".bewater/contracts/validation-evidence.schema.json"
  },
  "gates": {
    "foundation_gate": {
      "status": "passed",
      "freshness": {
        "status": "fresh",
        "checked_at": "2026-05-05T08:42:23Z",
        "stale_reasons": []
      },
      "concerns": [
        "素材链接下载能力、版权边界、素材匹配质量、LLM/TTS 成本与延迟需要在首个功能中继续验证。",
        "参考项目复核后，首个功能必须覆盖 artifact 管理、步骤状态和至少一个可审阅中间产物，避免只交付空任务骨架。"
      ],
      "blockers": [],
      "evaluated_at": "2026-05-05T08:42:23Z",
      "evaluated_commit_sha": null,
      "input_digest": "83e163ad12e7a4d741ec4402ee32b343694d29bca3045877e2ee206eb2b4db70",
      "produced_by": "init-flow",
      "evidence_refs": [
        "docs/00-project/foundation-review.md",
        "docs/00-project/reference-map.md"
      ],
      "input_refs": [
        "docs/00-project/vision.md",
        "docs/00-project/architecture.md",
        "docs/00-project/constitution.md",
        "docs/00-project/decision-log.md",
        "docs/00-project/foundation-review.md",
        "docs/00-project/reference-map.md"
      ],
      "input_digests": {
        "docs/00-project/vision.md": "0f7f6d1aebd03fa0fc1407496997a1da454f8aed517b737a219a1dc8e7055f0e",
        "docs/00-project/architecture.md": "55f5534962d8cafeacf8c6caf7011d2f3f7a2f02398cb93254500c79ef308454",
        "docs/00-project/constitution.md": "9e0546fef76ac49d9b2cb2e0e2783cde419085424a1eade97928560b7fd3dad8",
        "docs/00-project/decision-log.md": "4b42a623eb0c6904a77ec57804238cafc54c808be2f6d26a9cc232fa2dd2496c",
        "docs/00-project/foundation-review.md": "3180467055e910aee66ee5cffd515f4436c8dcfb9ba75cc8af7cb5dcef741a5b",
        "docs/00-project/reference-map.md": "ef553b11d41e28fbc72961a868b401b4177dd04e4146bd22d55c0674189aba8f"
      },
      "updated_at": "2026-05-05T08:42:23Z"
    },
    "feature_review_gate": {
      "status": "passed",
      "freshness": {
        "status": "fresh",
        "checked_at": "2026-05-05T08:46:25Z",
        "stale_reasons": []
      },
      "concerns": [
        "素材链接下载/解析存在不确定性，需要在 design.md 明确降级为上传素材与失败留痕。"
      ],
      "blockers": [],
      "evaluated_at": "2026-05-05T08:46:25Z",
      "evaluated_commit_sha": null,
      "input_digest": "57a5becad377ed54761bf6e503b3165cd8b7eeaa55efd2809eb9eb15c6e9897b",
      "produced_by": "goal-flow",
      "evidence_refs": [
        "docs/01-features/001-knowledge-task-skeleton/feature-review.md"
      ],
      "input_refs": [
        "docs/01-features/001-knowledge-task-skeleton/feature.md"
      ],
      "input_digests": {
        "docs/01-features/001-knowledge-task-skeleton/feature.md": "57a5becad377ed54761bf6e503b3165cd8b7eeaa55efd2809eb9eb15c6e9897b"
      },
      "updated_at": "2026-05-05T08:46:25Z"
    },
    "architect_gate": {
      "status": "passed",
      "freshness": {
        "status": "fresh",
        "checked_at": "2026-05-05T08:47:37Z",
        "stale_reasons": []
      },
      "concerns": [
        "首版 E2E 以 blackbox_smoke 为主，formal_e2e 后续补齐。"
      ],
      "blockers": [],
      "evaluated_at": "2026-05-05T08:47:37Z",
      "evaluated_commit_sha": null,
      "input_digest": "a4604431f61004d1e18db5a8e0693872d10deb561e9af78320177abf7eab973d",
      "produced_by": "goal-flow",
      "evidence_refs": [
        "docs/01-features/001-knowledge-task-skeleton/design.md"
      ],
      "input_refs": [
        "docs/01-features/001-knowledge-task-skeleton/design.md"
      ],
      "input_digests": {
        "docs/01-features/001-knowledge-task-skeleton/design.md": "a4604431f61004d1e18db5a8e0693872d10deb561e9af78320177abf7eab973d"
      },
      "updated_at": "2026-05-05T08:47:37Z"
    },
    "tasks_gate": {
      "status": "passed",
      "freshness": {
        "status": "fresh",
        "checked_at": "2026-05-05T08:58:10Z",
        "stale_reasons": []
      },
      "concerns": [],
      "blockers": [],
      "evaluated_at": "2026-05-05T08:58:10Z",
      "evaluated_commit_sha": null,
      "input_digest": "",
      "produced_by": "plan-flow",
      "evidence_refs": [
        "docs/01-features/001-knowledge-task-skeleton/tasks.md"
      ]
    },
    "prebuild_review_gate": {
      "status": "passed",
      "freshness": {
        "status": "fresh",
        "checked_at": "2026-05-05T08:58:10Z",
        "stale_reasons": []
      },
      "concerns": [],
      "blockers": [],
      "evaluated_at": "2026-05-05T08:58:10Z",
      "evaluated_commit_sha": null,
      "input_digest": "",
      "produced_by": "plan-flow",
      "evidence_refs": [
        "docs/01-features/001-knowledge-task-skeleton/prebuild-review.md"
      ]
    },
    "review_gate": {
      "status": "passed",
      "freshness": {
        "status": "fresh",
        "checked_at": "2026-05-05T09:34:18Z",
        "stale_reasons": []
      },
      "concerns": [
        "StepRunner 目前为 deterministic placeholder；后续接入真实 LLM/Reviewer 时需扩展 schema 与 eval 数据集。"
      ],
      "blockers": [],
      "evaluated_at": "2026-05-05T09:34:18Z",
      "evaluated_commit_sha": null,
      "input_digest": "",
      "produced_by": "build-flow",
      "evidence_refs": [
        "docs/01-features/001-knowledge-task-skeleton/review-note.md"
      ]
    },
    "ship_precheck_gate": {
      "status": "go",
      "freshness": {
        "status": "fresh",
        "checked_at": "2026-05-05T09:41:53Z",
        "stale_reasons": []
      },
      "concerns": [],
      "blockers": [],
      "evaluated_at": "2026-05-05T09:41:53Z",
      "evaluated_commit_sha": null,
      "input_digest": "",
      "produced_by": "ship-flow",
      "evidence_refs": [
        "docs/01-features/001-knowledge-task-skeleton/validation-report.md",
        "docs/01-features/001-knowledge-task-skeleton/release-record.md"
      ],
      "evidence_checked": true
    }
  },
  "runtime": {
    "active_flow": null,
    "subphase": null,
    "route_mode": "standard",
    "validation_outcome": {
      "classification": "ready_for_precheck",
      "release_decision": "go",
      "decider": "qa",
      "consulted_roles": [
        "reviewer"
      ],
      "evaluated_at": "2026-05-05T09:36:45Z",
      "recommended_next_action": "/bewater-ship",
      "evidence_refs": [
        "docs/01-features/001-knowledge-task-skeleton/validation-report.md",
        "docs/01-features/001-knowledge-task-skeleton/review-note.md",
        "docs/01-features/001-knowledge-task-skeleton/receipts.json",
        "docs/01-features/001-knowledge-task-skeleton/validation-artifacts/blackbox_smoke.txt",
        "docs/01-features/001-knowledge-task-skeleton/validation-artifacts/blackbox_retry.txt",
        "docs/01-features/001-knowledge-task-skeleton/validation-artifacts/lighthouse-workbench.json",
        "app/eval-results/001.json"
      ],
      "blockers": []
    },
    "retry_counters": {
      "auto_repeat_blockers": 0,
      "evidence_refresh_attempts": 0
    },
    "release_intent": null
  },
  "compat": {},
  "state_history": [
    {
      "from": "uninitialized",
      "to": "initialized",
      "command": "/bewater-init",
      "at": "2026-05-05T05:53:47Z",
      "evidence": "docs/00-project/foundation-review.md"
    },
    {
      "from": "initialized",
      "to": "specified",
      "command": "/bewater-goal",
      "at": "2026-05-05T08:46:25Z",
      "evidence": "docs/01-features/001-knowledge-task-skeleton/feature.md"
    },
    {
      "from": "specified",
      "to": "planned",
      "command": "/bewater-plan",
      "at": "2026-05-05T08:58:10Z",
      "evidence": "docs/01-features/001-knowledge-task-skeleton/prebuild-review.md"
    },
    {
      "from": "building",
      "to": "shipped",
      "command": "/bewater-ship",
      "at": "2026-05-05T09:41:53Z",
      "evidence": "docs/01-features/001-knowledge-task-skeleton/release-record.md"
    }
  ],
  "next_command": "/bewater-learn"
}
